Persona Layer,Description,Typical Titles / Roles (examples),Primary Focus,Signal KPI Priority
Executive,C-1 / C-2 leaders who set strategic direction and approve major decisions,"CEO, COO, CMO, Chief Supply Chain Officer, Chief Risk Officer, Chief Digital Officer","Macro market signals, category-level growth, competitive position, M&A & partnership opportunities, macro risk","Trend Scores, Heat Indices, Geo Maps — high-level, low-frequency, strategic horizon (3–12 months)"
Strategic,Directors and VPs who translate corporate strategy into plans and roadmaps,"VP Merchandising, Director of Marketing, Head of Revenue Growth, Head of Innovation, Director of Procurement","Category trends, competitive landscape shifts, white-space opportunities, regulatory change, consumer macro shifts","Trend Scores, Ranked Lists, Sentiment — medium frequency, 1–6 month horizon"
Operational,Managers who own specific functional KPIs and run day-to-day operations,"Merchandising Manager, Trade Marketing Manager, Supply Chain Manager, Category Manager, CRM Manager, Promotions Manager","In-week competitor moves, promo activity, supply disruption signals, demand spikes, campaign performance benchmarks","Event Pulse, Price Tracker, Velocity — high frequency, daily to weekly horizon"
Analytical,Analysts and data scientists who generate insight and build models from data,"Demand Planner, Pricing Analyst, Data Analyst, Consumer Insights Analyst, Revenue Assurance Manager, Yield Analyst","Statistical trends, forecast signal inputs, volatility indices, model input data, benchmark comparisons","Velocity, Heat Index, Trend Score — all frequencies; raw signal fidelity over summarisation"
Technical,"Engineers, scientists and deep specialists who build, maintain or optimise systems and products","R&D Scientist, Process Engineer, ML Engineer, Infrastructure Engineer, Yield Engineer, Grid Engineer, Formulation Scientist","Technology trends, research publication velocity, equipment/tool innovation, standards & compliance changes","Velocity, Event Pulse — focused on technical horizon signals; low frequency but high precision"
Frontline,"Customer-facing, floor-level and field execution roles who interface directly with customers or assets","Store Manager, Beauty Advisor, Branch Manager, Device Sales Manager, Field Service Manager, Patient Recruitment Manager","Real-time local demand, customer sentiment, competitor in-store activity, product/service buzz in local market","Sentiment, Event Pulse, Ranked List — real-time and hyper-local signals"
Governance,"Risk, compliance, legal and regulatory oversight roles who manage exposure and obligations","Compliance Officer, Regulatory Affairs Manager, EHS Manager, Risk Manager, Trust & Safety Analyst, IP Manager","Regulatory change, enforcement actions, ESG mandates, policy shifts, litigation trends, fraud typology evolution","Event Pulse, Ranked List — regulatory calendar driven; forward-looking horizon of 3–18 months"
